[
  {
    "schemaVersion": 1,
    "id": "prague-castle-1830",
    "status": "approved",
    "workType": "painting",
    "title": "View of Prague from the Castle Staircase",
    "artistOrCreator": "W. M. R. Quick",
    "depictedDate": { "minYear": 1830, "maxYear": 1830 },
    "creationDate": { "minYear": 1830, "maxYear": 1830 },
    "location": { "placeId": "prague-cz", "acceptedPlaceIds": [] },
    "classification": { "region": "Central Europe", "difficulty": 2, "landmarkCategory": "castle", "tags": ["river", "hilltop"] },
    "clues": { "region": "Central Europe", "era": "1830s", "country": "Czechia" },
    "media": { "originalPath": "prague-castle-1830.png", "focalPoint": null },
    "attribution": {
      "source": "Wikimedia Commons",
      "license": "Public Domain",
      "sourceUrl": "https://commons.wikimedia.org/wiki/File:View_of_Prague_from_the_Castle_Staircase_by_W._M._R._Quick.jpg",
      "creditText": null
    },
    "context": "Painted from the castle staircase overlooking the Vltava river and the Old Town skyline.",
    "contentWarning": null,
    "curation": { "approvedBy": "andrew", "approvedAt": "2026-08-09T00:00:00.000Z", "notes": null },
    "importSource": "firestore:0MDvrWOLpWuvP64Rm7xT",
    "createdAt": "2026-08-09T00:00:00.000Z",
    "updatedAt": "2026-08-09T00:00:00.000Z"
  },
  {
    "schemaVersion": 1,
    "id": "oslo-harbour-1900",
    "status": "approved",
    "workType": "photo",
    "title": "Christiania harbour",
    "artistOrCreator": null,
    "depictedDate": { "minYear": 1900, "maxYear": 1900 },
    "creationDate": { "minYear": 1900, "maxYear": 1900 },
    "location": { "placeId": "oslo-no", "acceptedPlaceIds": ["oslo-no"] },
    "classification": { "region": "Nordics", "difficulty": 3, "landmarkCategory": "harbour", "tags": ["water", "ships"] },
    "clues": { "region": "Nordics", "era": "1900s", "country": "Norway" },
    "media": { "originalPath": "oslo-harbour-1900.png", "focalPoint": { "x": 0.5, "y": 0.6 } },
    "attribution": {
      "source": "Wikimedia Commons",
      "license": "Public Domain",
      "sourceUrl": "https://commons.wikimedia.org/wiki/File:example-oslo-harbour-1900.jpg",
      "creditText": "Oslo Museum"
    },
    "context": "Christiania was renamed Oslo in 1925; this harbour view predates the rename.",
    "contentWarning": null,
    "curation": { "approvedBy": "andrew", "approvedAt": "2026-08-09T00:00:00.000Z", "notes": null },
    "importSource": "firestore:fOPIEbgzkEHP3s3iFCGy",
    "createdAt": "2026-08-09T00:00:00.000Z",
    "updatedAt": "2026-08-09T00:00:00.000Z"
  },
  {
    "schemaVersion": 1,
    "id": "prague-unverified-license",
    "status": "draft",
    "workType": "drawing",
    "title": "Unverified Prague sketch",
    "artistOrCreator": null,
    "depictedDate": { "minYear": 1810, "maxYear": 1820 },
    "creationDate": null,
    "location": { "placeId": "prague-cz", "acceptedPlaceIds": [] },
    "classification": { "region": "Central Europe", "difficulty": 3, "landmarkCategory": null, "tags": [] },
    "clues": { "region": "Central Europe", "era": "1810s", "country": "Czechia" },
    "media": { "originalPath": "prague-castle-1830.png", "focalPoint": null },
    "attribution": { "source": "unknown archive", "license": "", "sourceUrl": "", "creditText": null },
    "context": "Licensing not yet confirmed; must stay in draft until verified per plan.md §13 step 4.",
    "contentWarning": null,
    "curation": { "approvedBy": null, "approvedAt": null, "notes": "waiting on licence confirmation" },
    "importSource": "manual",
    "createdAt": "2026-08-09T00:00:00.000Z",
    "updatedAt": "2026-08-09T00:00:00.000Z"
  }
]
